id,Time,Comment,Time_owner,Comment_owner,Score
795,7 months ago,"My family did have a good time on the Dolphin swim and we certainly paid for it too! It was very expensive for a family of 4 $190/pp which I did not mind paying, but the photo package was significantly overpriced and based on the number of people in the photos. Since we had 4 people and wanted videos, we had to pay close to $400 for them to place our photos onto my phone...that's right, not even a flash drive. All in all, I appreciate the experience but wouldn't do this again.",7 months ago,"Thank you for taking the time to share your honest experience with us. We are glad to read this educational and interactive session with our dolphin and marine mammal specialist was a fun experience for your family.Our prices are competitive with other internationally recognized, 5-star dolphinariums similar to our facilities. The money from the swims & photos covers for the care, maintenance, and enrichment for our dolphin family. Furthermore, the profit made from the pictures allows us to do research on marine mammals, provide educational programs for kids at our local schools, efforts related to rescue, rehabilitation, and release of marine animals in need, as well as further projects to support and inspire change to our local community.Thank you again for your time and visit. We hope to welcome you back in the near future.",3
796,2 months ago,We had the best host ever !! Isha was Amazing!!,,,5
797,3 months ago,"I really had a good time on this tour. Beautiful views. Open bar, sandwiches, and a friendly crew. I really recommend it to you.",,,5
798,2 years ago,The para-sailing was fun. The crew were professional and no nonsense about safety and requirements. If you are lucky you'll see some whales. They are usually being chased by several boats.,2 years ago,"Thanks for the awesome review! We work hard to meet expectations like yours, and we‚Äôre happy to hear we hit the mark for you. Come back and see us soon.",5
799,2 months ago,"Mario, Pablo and Bea did a great job of keeping us entertained and fed as we sailed along enjoying the sunset outside of Cabo San Lucas.",,,4
800,3 months ago,It was great. Chicas was super friendly and made the whole day a ton of fun! Food and drinks at the end were a great way to end the trip,,,5
801,4 months ago,We did a sunset luxury cruise. It was pretty good. The food was okay and we had a few drinks.,4 months ago,All of us at Cabo Adventures look forward to welcoming you back in the near future and creating more fun memories. Hasta pronto!,4
802,6 months ago,"My wife and I bought the most expensive swim with the dolphins package. We were placed with some others and the whole experience took about 30 minutes. We did get to swim with a dolphin, and it was a unique experience for sure. Afterwards I expected to be over charged for pictures and video, but I was astounded to discover they charge $239 to get your pictures. That's more than the ticket to get in to begin with. That gouging ruined the whole thing for me, I felt like I was ripped off.On top of everything else, the videos we paid for were never copied to my wife's phone like they said.  So we didn't even receive the product they are selling.",6 months ago,"Thank you for taking the time to share your experience with us. We are glad to read this educational and interactive session with our dolphin and marine mammal specialist was a fun experience for you and your family.Our prices are competitive with other internationally recognized, 5-star dolphinariums similar to our facilities. The money from the swims & photos covers for the care, maintenance, and enrichment for our dolphin family. Furthermore, the profit made from the pictures allows us to do research on marine mammals, and efforts related to rescue, rehabilitation, and release of marine animals in need.It is important that you know that we can also arrange private programs so that your family is not with other guests.Thank you for your time and visit, we hope to welcome you back soon!",3
803,6 months ago,"Joel, Ladis, Disney, and Claudia were very good guides. They were very attentive and knowledgeable keeping our safety their first priority. The provided a very fun filled environment for the whole group! Would definitely recommend them for your next adventure.",6 months ago,We truly appreciate your comments.We are delighted to read you had an amazing time in our Outdoor Adventure and that you enjoyed all the activities throughout this exciting adventure. Thank you for mentioning our team members that made your experience more pleasurable.We are looking forward to welcoming you on many more trips!,5
804,7 months ago,"There were a couple of tour guides and water taxis as you enter the marina who promise better rates, but i say ignore them and head to Cabo adventures. This place is legit. Clean equipment and amazing tour guides, especially Carlos who was really nice and helpful. They even take good pictures. We took their snorkeling tour, which included kayaks and paddle boards if you wanted to try them in the end. And they also had yummy Quesadillas at the end of the tour",7 months ago,Thank you for visiting us at Cabo Adventures! We are delighted to read that your snorkeling experience was amazing and that te team service was so fantastic!We are looking forward to welcoming you on many more trips!,5
805,6 months ago,"Absolutely the best zip tour I've ever done, I need a couple more stars to give!!!I was a season's pass holder for two years at an adventure park, I try to zip and climb everywhere whenever I'm on vacation, and this was a phenomenal experience.Our guides (Joel, Mago, Arturo, Erid, Evaristo, Brandon, and Carlos) were quick, efficient, safe, and super fun from start to finish.  It was like hanging out with all the cool kids, and it felt like they were genuinely enjoying their jobs and they took amazing care of us all day.The upside down and Superman zips were glorious, and I loved the additional cable element, rock climbing wall, rappelling, and light bouldering that really made this tour stand out.The lunch was lovely, it's a gorgeous location, and they have a wonderful staff all the way across the board.  This is the only place where I've ever bought the photo package - the photographer was very professional and amazing at getting fantastic action shots and posed snaps for the memories.  No regrets!Thank you so much for an awesome day!!  When the shuttle came, I really just wanted to go back to the starting line and do it all again!",6 months ago,Thank you for taking the time to write about your wonderful experience at Cabo Adventures! We are delighted to read you enjoyed our Outdoor Adventure. Our team takes service very seriously and it is highly gratifying to read we achieved our ultimate goal of providing an exceptional experience for you and your family! We will pass along your comments to our team members.We appreciate your detailed feedback and certainly hope to welcome you back in the near future.,5
806,2 months ago,"Jorge was a great tour guide!  We had such a great time, and his sense of humor made the event fun!!",2 months ago,"We really appreciate your kind comments, Jorge will be happy to receive your feedback.From all the Cabo Adventures team we thank you for sharing your experience with other Adventurers!",5
807,a year ago,Great staff and service!  Snorkeling was a delight!  We saw many species of fish!!,a year ago,"Thank you for visiting us at Cabo Adventures! We are delighted to read that your snorkeling experience was an amazing one.

We are looking forward to welcoming you on many more trips!",5
808,3 months ago,Damian was an amazing tour guide. I had so much fun with him. An Amazing tour guide and so fun to be around.,,,5
809,a week ago,"Great tour. Food was great, tequila was a great experience and the camels were adorable.",,,4
810,4 years ago,"Highly recommend trying the Sea of Cortez adventure with Michelle and the other guides! Was simply breathtaking! Great service, great food, beautiful discovery of the Sea Lions and la Mar de Cortez. Thanks to the team for a great day! Yours truly- Montreal üëåüèª",,,5
811,a year ago,"Best experience for me. Whale watching and snorkeling  , feed us lunch and drinks the whole time.",a year ago,"Thanks for the awesome review! We work hard to meet expectations like yours, and we‚Äôre happy to hear we hit the mark for you. Come back and see us soon. Cheers!",5
812,a month ago,"Amazing experience. Great service, views, and snorkeling. The staff was excellent. Shoutout to Lucas, Mario, Vianet, and Johnny!",,,5
813,3 months ago,THE BEST day w/ Damien. UTV ride worth it!,,,5
814,2 months ago,Mario y Abigail were amazing tour guides! They were so informative and sweet and honestly best time ever,,,5
815,a month ago,You are very lucky if Gera is your tour guide he was amazing treated all of our group like his own family.,a month ago,"On behalf of everyone at Cabo Adventures, we truly appreciate your kind words and look forward to next time!",5
816,2 months ago,Jorge was great! We had a blast with him as our tour guide and the whole experience was so fun.,2 months ago,"We truly appreciate your review!It‚Äôs great to know you had such a wonderful experience with Cabo Adventures. On behalf of everyone in our team, thank you for your preference and see you soon!Sincerely,",5
817,6 months ago,"Excellent tour, the snorkeling was topped off by seeing multiple dolphins and whales.  Great crew, my wife & I thoroughly enjoyed the trip.  Nice facility just minutes from the dock",6 months ago,"Thanks for the awesome review! We work hard to meet expectations like yours, and weíre happy to hear we hit the mark for you. Come back and see us soon.",5
818,2 months ago,"Fantastic experience, Jorge was wonderful! His humor, personality, and wonderful knowledge. When I visit Cabo again I will come see Jorge.",2 months ago,"We truly appreciate your review!It‚Äôs great to know you had such a wonderful experience with Cabo Adventures. On behalf of everyone in our team, thank you for your preference and see you soon!Sincerely,",5
819,2 months ago,"Raz, Mario, Willbert, Mar and Johnny- fabulous crew! One of the best experiences Iíve ever had! Thank you for a fabulous time.",2 months ago,We truly appreciate your comments.We are delighted to read you had an amazing time in our Outdoor Adventure and that you enjoyed all the activities throughout this exciting adventure. Thank you for mentioning our team members that made your experience more pleasurable.We are looking forward to welcoming you on many more trips!,5
820,5 months ago,"Evaresto, Bieri, Brandon, Erick, Abraham were amazing. We had soooooo much fun the Outdoor Adventure trip was one of the best parts of our vacation. Zip lining, repelling, Bungie jump....soooooo fun. We would totally do it again if we make it back to Cabo. The staff was so helpful, so nice and so good",5 months ago,"Thank you for your amazing review and comments, especially regarding the service you received from our team members.All of us at Cabo Adventures look forward to welcoming you back in the near future and creating more fun memories. Hasta pronto!",5
821,3 months ago,"Too expensive for 25 min of Camel ride, too much talking, and rushing on the meal time. Photos expensive as well, same price as we paid for our Camel ride.",,,2
822,2 months ago,"The crew was wonderful...Jacob was so knowledgeable and kind, food and drinks were great. Diego took great pics!!!",,,5
823,3 months ago,"Captain Pablo , Jaros, and our photographer Roger were great to work with! Made the experience so much fun!",,,5
824,a year ago,The Cabo Dolphins was a one in kind experience that everyone should have. Our guide Andres and our dolphin was amazing. His love and compassion showed throughout the whole time! I fully recommend spending time with the dolphins and make sure Andres is your guide!,a year ago,"We truly appreciate your comments.It‚Äôs nice to know the service provided during your dolphin program was friendly and attentive. As a company, we welcome all comments since they help us learn and improve.Best regards,",5
825,6 years ago,"Did 3 tours, Dolphins Swim & Ride Experience,  Outdoor Adventure & Snorkel & Sea Adventure all three were great and staff very helpful and friendly.",,,5
826,2 months ago,"This was absolutely the best cruise tour we have ever taken!!! So fun and the guide was attentive, funny, and informative.",,,5
827,2 months ago,"Amazing excursion! Felt safe at every turn. Thank you Ladis, Dioney, Gus, and Liam!From Martin and Angie",,,5
828,2 months ago,Aloha Cesar for an awesome adventure! Your hospitality and guidance during the tour has been a great experience we will not forget.,,,5
829,2 years ago,We swam with the dolphins with our kids. I figured it's a one time kinda thing so we went all in and bought photos too. Great experience with Ed the trainer and Tony the dolphin.,,,5
830,8 months ago,"I did The swim experience with the Dolphins and it was phenomenal.  Our trainer Maria was the best. Our dolphin was 9yr old male, name started with a ""N"". The whole experience was Amazing. It was my birthday and Maria took the time to show me some extra love with the Dolphin.. 5 star all around.",8 months ago,"Thank you for celebrating your birthday with us at Cabo Dolphins!We are glad you loved it and look forward to welcoming you on a future adventure, duringyour next visit to Los Cabos.Warm regards and happy birthday!",5
831,2 months ago,"Damien and Aisha‚Äôs were amazing hosts. I found them to be very educational, friendly, approachable and just down right FUN!",2 months ago,"Thank you for your amazing review and comments, especially regarding the service you received from our team members.We can't wait to see you again and create more fun memories!Hasta Pronto!",5
832,2 years ago,Whale watching tours leave here.  The variety of boats at the Port are amazing.  The yachts in the Port are owned by the Rich and Beautiful.  One of the yachts in the Port on the day of our whale watching cruise was registered to a Billionaire.  The Whale Watching cruise did not disappoint.   Plenty of whales to be seen in the month of March.,2 years ago,"Thank you for your comments, we are thrilled to read you had a wonderful time and will pass along your comments to our team members.We look forward to welcoming you back in the near future.",5
833,a year ago,"Great time, recommend. We did the cabo blue sunset tour on a trimaran.",a year ago,"We are glad to know you enjoyed you activity, you did not take the tour with us but look forward to welcoming you on a future adventure, during your next visit to Los Cabos.",4
834,2 months ago,"Amazing time with Ladis, Carlos, Arturo, Mago and David.  For a scaredy-cat I can attest that I had a fabulous time.  For a true adventure I definitely would recommend.",,,5
835,3 months ago,"Jesus, chai, Dioney, Erick, and Pablo were amazing.   Fast, safe, funny, polite, and very professional    The whole experience was great.  Highly recommend.",3 months ago,"We really appreciate your kind comments, the team will be happy to receive your feedback.From all the Cabo Adventures team we thank you for sharing your experience with other Adventurers!",5
836,8 months ago,"The snorkeling excursion to the sea lion island was wonderful! I went with my boyfriend, 2 adult sons, and their spouses. Raz and crew were exceptional! Food was excellent, attention to safety was first and foremost. I've been traveling internationally for 20 years and this was one of my favorite excursions. I will do this again üòä.",8 months ago,Thank you for taking the time to write such a wonderful review about Cabo Adventures. We are delighted to read you enjoyed your adventure and appreciate your comments regarding our service.We look forward to welcoming you back in the near future and creating more unforgettable memories together.,5
837,2 months ago,"Great experience, Gerardo was a great tour guide",,,5
838,2 months ago,Isha was an amazing tour guide. So willing to share information or find out for us. Everyone was so kind.,,,5
839,2 months ago,Loved the camel ride experience!! Cesar was a great tour guide very informative & funny! Definitely worth it!,2 months ago,"Thank you for your 5-star opinion! We are thrilled to read about your experience; Indeed, our camel safari is a unique and memorable experience. We will be happy to pass along
your comments to our Adventures team.

Looking forward to your next visit!",5
840,3 months ago,Awesome time jet skiing with my fianc√©!,,,5
841,3 months ago,Chicas was an amazing tour guide!!Had a great experience and this is my second time coming here.I‚Äôll definitely be back for a third time.,,,5
842,3 months ago,Jorge was an excellent guide. Funny and engaging. The camels are beautiful and treated so well.,,,5
843,3 months ago,Love it!!!......Richard Noriega & Adrian made this tour so much fun. As a new person riding a ATV they made things so fun & very helpful.,,,5
844,3 months ago,Alain was a great tour guy! Had a blast and he showed us all the beautiful sights.,,,5
845,2 months ago,Alain was awesome. Give him a raise. 10/10 best worker there. The camera guy was also awesome.,,,5
846,5 months ago,"Great zip line experience. The guides (Joel, Brandon, Erick, Evaristo, & Abraham) were awesome! Fun, entertaining, and efficient! Would definitely do it again!",,,5
847,2 years ago,Great people. Very professional! Whale tour and sailing was awesome!,2 years ago,"Hello Matt,Thank you for sharing your whale watching and sailing experience with us at Cabo Adventures. We are delighted to read you enjoyed your adventure and appreciate your comments regarding our service.We look forward to welcoming you back in the near future and creating more unforgettable memories together.",5
848,2 months ago,Wonderful trip and she know who is very good with my sore back. We loved it. Mario too.,2 months ago,"On behalf of everyone at Cabo Adventures, we truly appreciate your kind words and look forward to next time!Warm regards",5
849,5 months ago,"The Superman zipline was amazing. The whole crew was really fun to hang out with, super nice, funny, and seemed to enjoy what they do. Made the whole experience unforgettable.",5 months ago,"Thanks for the awesome review! We work hard to meet expectations like yours, and we‚Äôre happy to hear we hit the mark for you. Come back and see us soon.",5
850,6 months ago,"Zip lining with Cabo Adventures was the best excursion our family has done in Cabo! Definitely recommend if you are up for a fun and thrilling adventure! Our guides were so helpful and kept the entire experience fun. Thanks to Arturo, Oscar, Chai, Mago, Roy. They were the best!",5 months ago,Thank you for taking the time to write such a wonderful review about Cabo Adventures.We are delighted to read you enjoyed your adventure and appreciate you mentioning our team members that made your experience more pleasurable.We are looking forward to welcoming you on many more trips!,5
851,2 months ago,"Nara , nael  and Jesus were awesome!Service it‚Äôs 100/10  wonderful tripThanks you guys for make this vacations the best!",,,5
852,4 years ago,The scenery was amazing and we had a good time snorkeling and paddle boarding too! Knowledgeable tour guide Juan and the captain and camera man were very nice and helpful as well!,4 years ago,"Dear Bridgett,Thank you for taking the time to bring your comments to our attention. We are glad you enjoyed the crew! We strive to provide world class quality and service on all of our excursions.",5
853,a year ago,"There are  numerous adventures to be had in Cabo. Take your time when choosing a provider. All are bilingual, and will take the American dollar, have the exact change. But have fun.",a year ago,"Many thanks for your visit and warm regards from the Cabo Adventures team!Sincerely,",5
854,5 months ago,"What a horrible and sad place. Anyone who is fooled and entertained by tormented wild animals ripped away from their homes should be ashamed of themselves. Looking at all the other reviews, it would make sense that these workers are sleazy clowns who try to scam you every opportunity they get.",,,1
855,a month ago,Awesome tour Mario did a great job,,,5
856,6 months ago,"Had an eventful day and enjoyed every bit of it. I purchased the atv+camels+lunch package. Before the excursions began, we had a quick seminar which Karla walked us through. This included background information on what they recycle and use out of the recyclable items in addition to a brief background of cacao making with. We then started the camel ride which went smoothly with the help of all staff- beautiful scenery. After the camel ride we proceeded to the atv riding which was an adventure itself. Brenda was with us the whole time assisting with a tutorial, helped when needed and kept up the great energy. We then had lunch which included a tequila testing. My friends and I were pleased with the flow of the excursions, service, and staff. Also want to shoutout the photographer! We loved all of the photos that were taken.",6 months ago,It is great to know you enjoyed your experience with us!We are happy to read that visiting Tierra Sagrada was a highlight in your trip. There are many natural wonders in the Baja and we would absolutely love to welcome you next time on the other adventures we offer to explore more amazing places around this beautiful area.Thank you again for your preference!,5
857,5 months ago,"The funnest adventure!! Amazing views, staff, course and experience. Mago and Chai and the whole team were phenomenal. I never thought zip lining would be so fun. I would highly recommend booking the trip with them!!!",,,5
858,3 months ago,Great whale watching tour. Good snacks and drinks. Lots of viewing area on the boat and not crowded.,,,5
859,a month ago,"Went on a luxury two-bay snorkel experience and had a blast with the crew of Lukas, Mario, Vianet, and Johnny.",,,5
860,3 years ago,"We got an informative tour with beautiful vistas. The captain, mate and photographer made this trip memorable. We were offered drinks soft and hard, taken close to the sites for photos and a good look.",3 years ago,"Hello David,Thank you for your recommendations and sharing your experience sailing on our luxury sailboats. We are glad to read you had a great time with our crew members and enjoyed the views like the Arch of Cabo San Lucas.We hope to welcome you back soon.",5
861,6 months ago,"This is our 3rd time doing the Dolphin Encounter at Cabo Adventures and either things have really changed to worse or it is just our bad luck with the bad experience and terrible customer service we had this time.Paying over $300 for two kids and being put with a large family of 5 adults was just the start of a disaster. My little ones hardly had a chance to ‚Äúbreak the ice‚Äù or get comfortable in the water‚Ä¶ It was super rushed for the kids with very little consideration to their age or comfort.With respect to staff there, I think the tips mentality is very dominant and really distract the trainers from doing their job properly and equally but they focus on pleasing the participating adults more. ü§ëWhat made the experience even worse was when we went to the studio to look at the ‚Äúprofessional‚Äù pictures/videos taken‚Ä¶ hardly any good pictures of the kids compared to the past, most of the kids pictures were with the other family covering the kids and the individual pictures are either rushed or poorly taken. Of course for the package price is EXAGGERATED - asking $365 USD for 5 clips of 1 to 6 seconds long and mostly of the big adult family in them.. We politely but disappointedly refused but we were followed outside by a nice staff Brenda offering us 40% off.It was still not worth it for us because there were literally 3 pictures that we wanted, Brenda suggested that she would talk to her supervisor and see what she can do‚Ä¶ When the ‚Äúsupervisor‚Äù Diana Mtz came out, she was VERY rude, unprofessional and with a nasty nasty attitude. She did not greet us at and all she said  was YES!? and left us explaining the situation from the beginning with zero empathy as if her team didn‚Äôt tell her anything.Maybe she was not happy that her team distracted her from being on her phone or she naturally carries the cunning, rude attitude with her all the time‚Ä¶ I just hope the team around her are not learning her rudeness. Basically she said that‚Äôs all we have for you, take it or leave it.I am sure the young and kind photographer did his best even though it was not at the level of the price.All I have to say that, it was a waste of time and money for us today + the worse customer experience we had in our life from a person who should be leading by a good example to a team.Hasta Nunca!!",,,1
862,a year ago,"Cabo Adventures is the way to go! We booked with them through our hotel for swimming with dolphins, signature swim. They picked us up at the hotel right on time and took us back afterwards. They opened up the indoor skydiving that day and we were one of the first customers to try it out after our swim. Hector and the team were great! Next time we are in Cabo, we will be back. We want to do the üê™ rides!",a year ago,"We truly appreciate your review!It‚Äôs great to know you had such a wonderful experience with Cabo Adventures. On behalf of everyone in our team, thank you for your preference and see you soon!Sincerely,",5
863,10 months ago,A nice stroll with lots of souvenir shops.  Wear your sun hat and plenty of sunscreen if you take this adventure during summer,10 months ago,"On behalf of everyone at Cabo Adventures, we truly appreciate your kind words and look forward to next time!Warm regards",5
