id,Time,Comment,Time_owner,Comment_owner,Score
1300,a year ago,Went on a sunset sail and expected it to be super touristy and maybe buttoned-up and boring / corporate - but it was not like that at all.  The captain (Juan) and crew were amazing. They made it educational and such a fun time. Highly recommended.,a year ago,"We really appreciate your kind comments, Juan and the team will be happy to receive your feedback.From all the Cabo Adventures team we thank you for sharing your experience with other Adventurers!",5
1301,a year ago,"Even though you have to pay extra for travel to and from your resort, the whale watching tour was worth the price. Not only did we see 3 whales breach, our tour guide was smart and funny. It's well worth the price.",a year ago,"Thank you for taking the time to share your experience with us. We are glad to read that you enjoyed your activity.It is important to mention that transportation is an optional service that we offer from most hotels in Los Cabos, should you not wish to take advantage of this service, all guests are welcome to make their own transportation arrangements covering their own cost.If there is anything else we can do for you, please contact us at info@cabo-adventures.com",4
1302,a year ago,Party boats not my usual scene but I was not the oldest partner by far. Dos Equis por favor.,a year ago,"Thanks for your review! We work hard to meet expectations like yours, and we‚Äôre happy to hear we hit the mark for you. Come back and see us soon. Cheers!",5
1303,7 months ago,"Borja, Dioney, Jesus, Ladis, and Roy made the trip great! The adventure was incredibly fun and safe. Highly recommend Cabo Adventurers Zipline and UTV to anybody.",7 months ago,"On behalf of everyone at Cabo Adventures, we truly appreciate your kind words and look forward to next time!
Warm regards",5
1304,a year ago,"We went on the Luxury Sailing tour and I cannot express how much fun we had with Erick and Charly!  It was honestly the highlight of the trip.  The tour included snacks, open bar, lunch, paddle boarding, and snorkeling.  We loved having a photographer on board as well to capture all of the moments that we would not have thought to snap a picture of at the time.The pick-up from the hotel was seamless and the check in was fast and easy.  It was seriously such a great time that we considered signing up for another tour if there wasn't forecast for bad weather in the upcoming days.I can't recommend this enough! I will be telling everyone who is traveling to Cabo to take this tour!!",a year ago,Hi Kayla!Thank you for having taken the time to post your wonderful review of Cabo Adventures and sharing how much you enjoyed our Luxury Day Sailing. We were truly honored to read that our team members exceeded your expectations with their service and truly appreciate your recommendations to other adventurers.All of us here at Cabo Adventures are looking forward to welcoming you back soon.Best regards!,5
1305,5 months ago,"Good experience with them, very professional. Always buy tickets directly from them instead of brokers or other small companies.",5 months ago,"On behalf of everyone at Cabo Adventures, we truly appreciate your kind words and look forward to next time!Warm regards",4
1306,a year ago,We had an great time with David and sexy mexi on the combo tours it was a wonderful experience. Also the luxury sailing cruise was everything we could have asked for. When we started to sail it was a amazing  and we loved every minute of it.,a year ago,"Thank you for your amazing review and comments, especially regarding the service you received from our team members.

We can't wait to see you again and create more fun memories",5
1307,10 months ago,"We bought the camel experience. The truth is that the experience is not bad, it is quite good and the food too, the guides are very friendly.

Butoooooo!!!!! What really made us leave with a very bad taste was the photography costs.
Honestly, they are in heaven, and of our group of 17 people, only two bought the photos.

RECOMMENDATION RECOMMENDATION
TAKE YOUR PHOTOS! Even if they forbid you, do it because they will take an eye out of your face for them! If I had read the comments before, I would have listened to them.

Sadly, and this is where you can see the business, they don't let you take your cell phone with you, they even have signs prohibiting you from using it for photographs, in case the attraction is not cheap and apart from that they charge you for very expensive photos, and you only get them send to your cell phone
In other words, a package of photos to your cell phone for $1,900, or photos plus video for $2,900!!!!! Don't invent!
The worst thing is that you cannot take a memory of that moment with you because it is very expensive.
I ended up not enjoying it anymore because in the end
I couldn't take my photo with me, something that without a doubt I think many also go. If you take the beautiful experience but the memory or the photo where could you show your relatives and acquaintances?
Zero on that.",10 months ago,"We appreciate your comments, we are glad that you enjoyed your activity.

The safety and well-being of our guests is our priority. For this reason, we ask you not to use cell phones, cameras, or any device that takes your attention away or requires you to make movements outside of grabbing the handlebars, since you must hold them with both hands during the ride.

The prices of the photographs not only cover the care, maintenance and enrichment of our family of camels, but also give us the opportunity to provide them with the service of expert photographers with professional equipment.

With that said, we appreciate you letting us know. Feel free to contact our photography team if you have any other questions or concerns at customerservicephoto@cabo-adventures.com",2
1308,a year ago,"A dream place, if you don't know how to swim, like me, you will have to be very close to the beach, the waves are very strong ",a year ago,"Thank you for your preference and we hope to see you again soon in Los Cabos,",5
1309,2 years ago,"Outstanding experience, entertaining and educational. Kudos to Isha and Luis for fantastic tours!",2 years ago,From all the Cabo Adventures team we thank you for sharing your experience with other Adventurers!,5
1310,4 months ago,"The reservation was good, however when we got to the main place we were treated in a very bad way",4 months ago,We are surprised to read your comments about our team service,2
1311,3 weeks ago,Excellent service from all employees,,,5
1312,a year ago,"Our sunset sail with Cabo Adventures left us speechless. The views were breathtaking, the crew was fun, knowledgeable, and professional, and the photographer got great shots! An amazing experience all around.",a year ago,"We truly appreciate your review!It‚Äôs great to know you had such a wonderful experience with Cabo Adventures. On behalf of everyone in our team, thank you for your preference and see you soon!Sincerely,",5
1313,6 months ago,"The trips they run remain excellent. Solid equipment, fun staff. The pricing is getting out of hand, particularly the photos.",6 months ago,"We truly appreciate your review!

Itís great to know you had such a wonderful experience with Cabo Adventures. On behalf of everyone in our team, thank you for your preference and see you soon!

Sincerely,",5
1314,11 months ago,"Our crew were so friendly and knowledgeable! We did two tours, both of which were lovely! We cannot recommend Cabo Adventures enough. Special thinks to our photographer Mari!",11 months ago,"Thank you for your amazing review and comments, especially regarding the service you received from our team members.We can't wait to see you again and create more fun memories!Hasta Pronto!",5
1315,a month ago,"Cheers to Chicas! Excellent tour, excellent food, even better tequila!",a month ago,"On behalf of everyone at Cabo Adventures, we truly appreciate your kind words and look forward to next time!",5
1316,2 months ago,It was a great activity for kids for who would love to create unforgettable experiences and memories.,2 months ago,"Thank you for your amazing review and comments, especially regarding the service you received from our team members.We can't wait to see you again and create more fun memories!",5
1317,2 months ago,Camel tour was excellent. ATVs with Mario was once in a lifetime!,,,5
1318,2 months ago,We would recommend this company for a great experience.  Thank you marliz you are incredible.,2 months ago,All of us at Cabo Adventures look forward to welcoming you back in the near future and creating more fun memories. Hasta pronto!,5
1319,a year ago,"So much fun and wonderful experience.  I enjoyed Alii and our trainer, Maria were amazing.  The swim was great and learned more about dolphins.  Enjoyed watching the dolphins play after we finished.  I really liked this pool as there was a ledge to sit on.",a year ago,"We truly appreciate your review!It‚Äôs great to know you had such a wonderful experience with Cabo Adventures. On behalf of everyone in our team, thank you for your preference and see you soon!Sincerely,",5
1320,10 months ago,"If you are looking to be treated with 5 star service on your private sail, look no further then Thomas & Pablo. They were so attentive and made our experience! Highly recommend.",10 months ago,"Thank you for having taken the time to post your wonderful review of Cabo Adventures and sharing how much you enjoyed our Luxury Day Sailing adventure. We were truly honored to read that everything you experienced was great, including your time with our team members.

All of us here at Cabo Adventures look forward to welcoming you back soon.",5
1321,a year ago,"After 18 years of visiting Cabo, still the best sunset cruise we have found.",,,5
1322,a month ago,"Good attention, good treatment, friendly guides at all times !!",a month ago,"On behalf of Cabo Adventures and our entire team, thanks again for your preference and we look forward to seeing you soon!",4
1323,2 months ago,"Jorge is an excellent guide, very friendly, fun and shared many curious facts. Health!!",,,5
1324,11 months ago,We had AndrÈs and Aqua such a beautiful experience. AndrÈs was super sweet with my Daughter and had such patience with her. Our team was super nice as well. They let my daughter go 1st. Thank you AndrÈs for being an Angel with my girl. And aqua la delphine who is 29 years old was a sweetheart. Thank you from the bottom of my heart for the experience!,11 months ago,"We greatly appreciate your comments, we are very pleased that you enjoyed our interactive program with dolphins. Thank you for your recognition of our members of Cabo Dolphins, they will be happy to know that their efforts have been recognized.

We would love for you to visit us in the near future and create more unforgettable experiences!",5
1325,7 months ago,"This place is a joke, they should close this place since they are thieves with ties apart from that I have to pay almost 300 dollars to be with the dolphins the trainers only talked about tips and when we went for the photos the cheapest ones were worth 197 dollars according to them they don't sell photos individual this is a total rip off many people at the time were very angry",,,1
1326,5 months ago,"Do not visit it, the people who organize it are ruffians, they charge a price and when the visit was to be made they left with the lack of more money. It is not recommended.",5 months ago,"We appreciate the gesture of sharing your comments about your experience with us.

Information on additional charges is made clear in all of our promotional material, as well as on our website in the ""What you need to know before you book"" section of each adventure.

Feel free to contact us with any other questions or concerns at info@cabo-adventures.com.

Thanks again for your time and visit. We are hoping to welcome you soon.",1
1327,5 years ago,Had a great time whale watching here! Got to see some amazing whales.,,,4
1328,11 months ago,Our group loved the camel ride. David was an amazing tour guide. I learned some interesting things about the area and some of the plants. Ii would definitely recommend this tour if you are ever in Cabo.,,,5
1329,11 months ago,"Awesome experience with Paola doing the dolphin trainer for a day tour! Paola is a gem - kind, knowledgeable, encouraging- and the whole day was magical for my daughter and me. Highly recommend!!",11 months ago,"We really appreciate your kind comments, Paola will be happy to receive your feedback.From all the Cabo Dolphins team we thank you for sharing your experience with other Adventurers!",5
1330,a month ago,Alain was amazing!!! We can‚Äôt wait to come back and do it again!!,a month ago,"On behalf of everyone at Cabo Adventures, we truly appreciate your kind words and look forward to next time!",5
1331,2 months ago,Mario was awesome...made the trip really fun..would def recommend,2 months ago,"On behalf of everyone at Cabo Adventures, we truly appreciate your kind words and look forward to next time!",5
1332,3 months ago,Ebike trip was fantastic. Isaac a wonderful and great margarita creator.,,,5
1333,a year ago,"good service, on time and with high service level. although, on MY scooba dive, marine fauna was a little poor.",a year ago,All of us at Cabo Adventures look forward to welcoming you back in the near future and creating more fun memories. Hasta pronto!,4
1334,a year ago,"This trip is well planned out and was an amazing experience so I am giving 5 stars. The downsides I point out do not drop it below 5 stars but I want people to know my full experience.They pick you up from your hotel in a nice van shared with a few others, the driver was very nice and opened the door for us. They ask for a tip here (Tip 1). I‚Äôm pointing out the tips because I did not bring enough cash since I didn‚Äôt know we would have to be tipping so many different people in a prepaid excursion.You arrive at the Cabo adventure headquarters in the marina and you check into your trip and wait for everyone to arrive. During this time you can use the clean bathrooms, watch dolphins in the tank, or have a coffee or other drink/food from their small coffee shop.Next you meet your tour guide (ours was the very happy/positive Michelle) and load the bus where you are offered a delicious meat/cheese/tomato/lettuce/cucumber sandwich for breakfast, it was actually really good even without condiments.During the bus ride Michelle educated everyone on whale sharks and what to expect for the day and answered questions. The bus ride was comfortable and had a good view. You have to trip Michelle and the bus driver separately here. (Tip 2).Once we arrived we changed into our wet suits, used the bathroom, and put our bags in storage. Then we loaded the boat where they had towels, fins, and goggles with snorkels. They didn‚Äôt have enough fins for everyone on the boat so we had to switch off. The boat was very crowded and kinda hard to move around. **id recommend bringing your own towel to leave on shore because all there towels got soaked. The water is cold so you‚Äôll want a dry towel to help change into your clothes you brought. There isn‚Äôt much room in the bathroom to change though.We brought our own go pro to use which worked well to get our own photos if you can‚Äôt afford the 50 dollar ones they offer.We got three swims in each and some people did more than that. It was a workout trying to keep up with them and very hard to see them since the water was so cloudy but when you get the chance to finally see them it‚Äôs magical. There was also dolphins that had my husband jumping into the boat with no ladder.Each boat has a tour guide that gets in the water with you and is the photographer/videographer as well as the captain who drives the boat. Each boat only gets one shark so stick to the shark you have since they don‚Äôt want to overwhelm one shark.David was our guide in the water. (Tip 3 - water tour guide and captain).You get off the boat cold and wet so you change and warm up in the sun while eating fish tacos. They were good. I recommend bringing pesos because the bar there only let you use card if your order is over 300 pesos and I used dollars and they gave me the wrong change back. I was missing about 4 dollars. (Tip 4- the people who cooked the fish tacos provided from the tour).We then stop at hotel California for about 20 ish minutes. Walk around and got some good Oreo ice cream and a okay coffee.Then you return to Cabo adventures if you want or the main large coach bus can take you back to your hotel/or the same smaller van.Overall it was a very long fun day. The team as a whole was very nice and knowledgeable. I just wish I brought more cash for all the different tips and a dry towel.You can bring stuff on the boat but it might get lost or wet so id leave as much as you can locked up on shore.",,,5
1335,2 months ago,I had a great experience! Damian and esha were the best ever.,,,5
1336,2 months ago,"Very nice experience, thank you isha for sharing your time and your good attitude!!",,,5
1337,2 years ago,"Very good attention, excellent coordination for all tours, great hygiene care",2 years ago,"Dear Alexandra,

It fills us with satisfaction to know that you had an excellent experience with Cabo Adventures. We would love for you to visit us in the near future and create more unforgettable experiences.",5
1338,6 months ago,"A wonderful experience!!
Excellent service, everything of excellent quality and the animals well cared for.
The trainer Paola is a wonderful person!",6 months ago,"We are proud of your recommendation of Cabo Adventures! Our mission is to create unforgettable experiences and we are glad that we fulfilled our mission.

We hope to see you again in Los Cabos soon.",5
1339,a month ago,"Very good experience, thanks to Jorge for the attention and making our tour unique!",,,5
1340,11 months ago,"Awesome experience, I am very impressed with the professionalism, knowledge of the Cabo Adventures team and establishment. Keep up the amazing work with tourists and with the helping of the environment. To conclude, I would definitely recommend Cabo Adventures to all my acquaintances.",11 months ago,"Thank you for your amazing review and comments, especially regarding the service you received from our team members.We can't wait to see you again and create more fun memories!Hasta Pronto!",5
1341,a year ago,The Best boat ride I've ever been on !!! The food was Delicious and the drinks kept coming!!!!,a year ago,Thank you for your comments regarding our Luxury Day Sailing adventure. We are thrilled to read you had a wonderful time and will pass along your comments to our team members.We look forward to welcoming you back in the near future.,5
1342,3 months ago,Bill was awesome!! The entire experience was well worth the time and money!,,,5
1343,a year ago,"10/10 highly recommend. Our trainer Maria was awesome! She made us feel safe with nakia, they were the perfect duo. Saul our photographer was amazing as well. All of our pictures came out great!! Make sure you guys go and ask for Maria/ Nakia and Saul!",a year ago,"Thank you for your amazing review and comments, especially regarding the service you received from our team members.We can't wait to see you again and create more fun memories!Hasta Pronto!",5
1344,2 months ago,"Jorge our guide was amazing, and very funny. It was a pleasure",,,5
1345,11 months ago,"Paola gave us an amazing experience swimming with the dolphins. She was funny, educated, and made the experience really that much better. It was something we will never forget. We will be back! Thank you Paola!",11 months ago,"We really appreciate your kind comments, Paola will be happy to receive your feedback.From all the Cabo Adventures team we thank you for sharing your experience with other Adventurers!",5
1346,9 months ago,I really really enjoyed the lessons they gave us about the camels and the area,9 months ago,From all the Cabo Adventures team we thank you for sharing your experience with other Adventurers!,5
1347,2 years ago,"I did the 40 minute dolphin experience and it was really wonderful. Everyone was so nice and while I was the only single person with everyone else being couples, I was included and welcomed still. 5 stars for the experience. The reason for only 3 stars is as follows:The photographer was amazing and captured really amazing images and videos - which I purchased. They put them on a flash drive for me and when I got back home to the states and plugged it into my computer, however, the one video that was of me swimming underwater with the dolphin was not on the flash drive. I emailed the business and got a response saying I would have to email someone else, which I did. I told them that the video was missing and they responded & told me to look more closely on my phone, but the photographer and I had already discussed it and that my phone would not work for them, which is why I purchased the flash drive instead in the first place. I responded telling them this, and they just never responded back.I'm super disappointed - it was a really incredible video that I would have loved to share with my family to show them my experience.",2 years ago,"Thank you for your amazing review and comments, especially regarding the service you received from our team members.Regarding the missing video, please share with us all your information at marketing@cabo-adventures, in order to help you recovering your video and pictures.All of us here at Cabo Adventures look forward to welcoming you back soon and creating more unforgettable memories together.",3
1348,2 months ago,Ger was the best tour guide for us. Really personable and professional.,,,5
1349,a year ago,Service was amazing. Best staff! My husband and I went on the cabo adventures whale shark experience and it was totally worth it. Our whole day was filled to the brim with activities! Advice is to not have anything else booked for the day just dinner at night time. We toured with cesar and Michelle and did the dive with captain Mario and david..,a year ago,"We truly appreciate your review!

Itís great to know you had such a wonderful experience with Cabo Adventures. On behalf of everyone in our team, thank you for your preference and see you soon!

Sincerely,",5
1350,2 months ago,"Everything is very nice, but the prices of the photography packages are somewhat expensive",,,5
1351,2 months ago,It has good tour packages for walks. The attention is excellent,,,5
1352,2 months ago,Had an awesome time! Bill was a great tour guide!,,,5
1353,9 months ago,"Visited the cabo dolpin adventure today. They dont let you bring your camera and charge 250+ for pictures!!! Our 2 years old did so great, but they wouldnt let us just buy ONE picture for souvenir and to show him later. Extremely disapointed and felt it robbed our experience",9 months ago,"We appreciate your feedback and the opportunity to discuss your experience with us. The welfare of our dolphins and guest safety during the program is our main priority; for this reason, we do not allow guests to take cameras, cell phones, jewelry or any other article into the dolphin habitat. We provide an optional photo experience and an observation area in which non-swimmers can catch those magical moments.The money from the swims & photos not only covers for the care, maintenance, and enrichment for our dolphin family but also allows us to provide you with well-trained, professional photographers and the best underwater equipment to capture that once-in-a-lifetime moment.Please feel free to contact us with any further questions or concerns at customerservicephoto@cabo-adventures.comOn behalf of everyone in our team, many thanks for your time and visit.",1
1354,11 months ago,Paola and tlatoani (dolphin) were awesome. Super nice and so much fun!!! I felt super comfortable with both of them and we got to do really cool tricks with the dolphin.,11 months ago,"It‚Äôs great to know you had such a wonderful experience with Cabo Dolphins. On behalf of everyone in our team, thank you for your preference and see you soon!Sincerely,",5
1355,10 months ago,We did the boat ride to the arch and the camel ride and we had a blast! Alexus was a great guide and he made the trip really fun. I highly recommend it!,10 months ago,"Thank you for your amazing review and comments, especially regarding the service you received from our team members.We can't wait to see you again and create more fun memories!Hasta Pronto!",5
1356,3 months ago,Amazing experience and our guide Alain made it all worth it . Mucho gusto.,,,5
1357,a year ago,"Joel, Jonaton and the rest of the crew were awesome.  1st time for us zip lining.  We are very glad we did.  My wife has a fear of heights but the guys helped her through.  Great time, highly recommend.",a year ago,"Thank you for your amazing review and comments, especially regarding the service you received from our team members.

We can't wait to see you again and create more fun memories!

Hasta Pronto!",5
