id,Time,Comment,Time_owner,Comment_owner,Score
361,3 months ago,"I went on the catamaran sailing tour with my friend March 20th at 10:00 AM. We were on boat X (or ten). Our tour was with Jesus, Victoria, Chino and a rude captain whose name I forgot. This review is not about Chino or Victoria. Victoria was absolutely amazing, going out of her way to make sure we had the best experience.My friend and I were the only black people on this tour, and we were treated unfairly by Jesus and the captain. I wish I could remember the captain‚Äôs name because he is the reason for this bad review. On the 4-hour trip, I asked him 2 questions and he acted like it was an inconvenience for him. He was very impatient and uninterested towards us yet he was going above and beyond to cater to the needs of the other guests. He did not help me with the paddle boards, while he assisted the other guests. They did not check on us like they did the other guests. They did not help us get off the boat, when they held their hand out for the other guests. And at the end when we tipped them a few dollars (because of their bad service), the captain said ‚ÄúI don‚Äôt like that.‚ÄùI know this is not reflective of the company, as the others who assisted us at the meeting place were nice. But Jesus and the captain do not treat black people with respect. Very disappointed.Victoria was the only person who treated us like a valued guest!The captain is pictured since I don‚Äôt remember his name.",,,3
362,2 months ago,It was fun.  2 Bay snorkeling was our tour.,,,5
363,3 weeks ago,Swimming with the Dolphins was absolutely amazing! Our ‚Äúguide ‚Äú and trainer was awesome. We were a group of eight and he did a fantastic job. THANK YOU ERIC!!!,,,5
364,3 months ago,"We had an amazing whale watching experience.This 4 star review is because the ladies at the cafe were the most rude, mean and with a horrible attitude,  in fact they don't even deserve 1 star.Everyone else was great, but these 3 ladies. They should not work there clearly they don't like this job",,,4
365,3 months ago,We had a great time but the only reason I booked this excursion was because my son wanted to do sea scooters and I guess they were broke down. Otherwise my son had a great time.,3 months ago,Thank you for your comments regarding your experience with us. We are happy to read you had a great time and will pass along your comments to our team members. We also appreciate you mentioned the opportunity areas you encountered during your visit; we will consider them in the future.We look forward to welcoming you back in the near future.,3
366,4 months ago,The actual trip was great and loved it every time.  The transportation service they provided gave us a time and left at least 10 minutes early.  We arrived for pick up 10 minutes before and no one was there.  Met a couple of nice employees trying to help but then the manager claimed video had them leaving at a time that was obviously not true.  We didn‚Äôt argue with him who was being very rude.  Get your own transportation it is better.,4 months ago,Thank you for your comments regarding your experience with us. We are happy to read you had a wonderful time and will pass along your comments to our team members. We also appreciate you mentioned the opportunity areas you encountered during your visit; we will consider them in the future.We look forward to welcoming you back in the near future.,2
367,2 months ago,"We got to see the whales and the boat was beautiful. We sat upstairs in the comfy seats and had great views. Yummy mimosas with fresh OJ. The ‚Äògourmet lunch‚Äô was just sandwiches, it was a lovely half day at Sea!",2 months ago,"Thank you for your amazing review and comments, especially regarding the service you received from our team members.All of us at Cabo Adventures look forward to welcoming you back in the near future and creating more fun memories. Hasta pronto!",4
368,2 months ago,"Aline was the best host my family and I have ever had on an excursion.  Crazy cool, kind and fun.  Took great care of our safety.   He‚Äôs the best and we will seek him out next year. God Bless you and your two beautiful kids and wife of 17 years. Salud",,,5
369,2 months ago,"Michael, our ATV guide was EXCELLENT! Very knowledgeable and funny. Made us feel really comfortable! ü§üüèæ",,,5
370,4 weeks ago,Person who sold our trip completely lied about the experience.    We were to have private transportation with direct travel.  Instead we were put on a charter bus that had 4 stops prior to leaving.  When our trip was over we couldn't leave for an hour until other people could fill the bus on the return.    The Polaris adventure was awefull.  They said it was two hours and we would go through rivers and ride on the beach.  The river was homemade and we never got to ride on the beach. The ride was only one hour and then one hour at a restaurant.  Worst experience ever.Once our charter bus filled up we had to make 4 more stops letting people off.   We spend 3 hours on a bus and one hour on our polaris.   Avoid this company at all costs.,,,1
371,4 years ago,Passed on paying $138 per person for the Carnival cruise excursion and did this one for $30 per person (after haggling of course) and bought our own lunch and drinks in an air conditioned restaurant. This tour took us around lands end and stopped at several beaches. Came back to get us after spending an hour on one beach.,,,5
372,3 months ago,"3/5 stars due to Cabo Adventures convincing us to go to a ‚Äògolf package‚Äô sales pitch when in actuality it was a 3 hr timeshare presentation. Despite this, we only paid $15/pp for the 2-Bay ‚Äòluxury sailing‚Äô excursion.Luxury is a stretch since there were ~ 30 of us on board a catamaran. Open bar was great and the highlight! Drinks were strong - and flowing (haha). The guides were very nice and charming :-)We were served a bento box of fruit and yogurt before a tasty sandwich lunch after snorkeling!Overall, not sure I would want to pay $100+ for this experience.",,,3
373,3 months ago,"This is a world-class tourist trap. We spent over $450 for a bad day. Extra charges, bad food, creepy tour guides - little everything here is overpriced, underwhelming, and completely overrated.Starting with the $20 per person entry fee to get into the ‚Äòpark‚Äô, the $35 insurance fee per person for the super lame ATV tour (never went over 15 mph, only lasted 30 mins), and the $20 lunch per person. Then the pictures were $180 bucks for the cheapest thing‚Ä¶ you couldn‚Äôt even take your own.Furthermore, this creepy guide kept hitting on my girlfriend and was all over every woman in the group‚Ä¶. My girlfriend was so uncomfortable the rest of the time, it literally ruined her time.Wish I could take my money back and my time back, and forget about this horrible experience. Do yourself a favor, and rent a boat instead. This is totally lame in every way imaginable",,,1
374,a year ago,"Edson our trainer, and Juan our photographer did a wonderful job.  Our dolphin, Liz was sweet, beautiful, smart, majestic & beyond my imagination.  At times, our experience did feel a bit rushed and slightly overly scripted.  Also, the packages do not include the photos - so whatever you spend up front, expect to double it for photos and tips and the like.  That all said - it is really a once in a lifetime experience to be with these beautiful animals... and if you're in Cabo, it is well worth the $.  Do the VIP experience to get the most time with the dolphins... And have cash on hand in the right denominations for tipping - no one has any change.  The dolphins are well cared for and happy.  Watching them play together up close was pretty spectacular.  ‚ù§Ô∏è",,,4
375,4 months ago,"Overall, we really enjoyed the whale watching activity. We saw several humpbacks and a gray whale. A baby humpback kept breaching near us as it seemed to be in a playful mood. Between the yacht and the captain, the y kept the ride pleasant even though the water was a little turbulent at times. I never felt the least bit seasick or unsafe. The crew did a good job of keeping everyone‚Äôs glass full, however I will say  the lunch was nothing exceptional. The tour guide was knowledgeable, but sometimes he was hard to understand because he talked very fast and had a thick accent when speaking English. After we had seen numerous whales, they put a listening device in the water so we could hear the whales communicating, but it did not work. It was a great experience but there were some areas for potential improvement.",4 months ago,"Thank you for taking the time to write about your experience with us, we are glad to know you had a good time.All our guides are bilingual, some even are trilingual, and we are extremely proud of their skills and knowledge, if the guide was speaking too fast for you we encourage all of our guests to feel free to ask our team members to slow down with their speech or repeat what was said, as guest experience is a must for us.Thank you again for your time and visit. We hope to welcome you back soon.",4
376,3 months ago,"Jesus, Karim were awesome! We had an amazing time, would 1000% recommend if you come to Cabo San Lucas!!",3 months ago,All of us here at Cabo Adventures look forward to welcoming you back soon and creatingmore unforgettable memories together.,5
377,10 months ago,"I did 2 tours with cabo adventures , snorkeling and electric beach biking snorkeling was great, had several helpers, water was murky and itís a bit crowded with other tours so you have to watch out for other boats, beach biking was not what I was expecting as we were dessert mountain biking really, I wouldnít take anyone under 14 on it and if youíre older make sure you are in great shape, I fell twice second time I fell into the handle bars and still bruise and hurt today, the guides kept asking if I was ok even when I said I wasnít but I pushed through the rest and got an ice pack in the end, enjoyed it overall but wouldnít do the bike  ride again. definitely would book with cabo adventures when iím back",10 months ago,"On behalf of everyone at Cabo Dolphins, we truly appreciate your kind words and look forward to next time!Warm regards",4
378,2 months ago,So much fun all the workers are great dolphins are so much fun to play with photos are a little pricey but when will we do this again?,2 months ago,"On behalf of everyone at Cabo Adventures, we truly appreciate your kind words and look forward to next time!",5
379,5 months ago,When we stopped at the Cabo adventures booth to book a tour we were asked what we wanted to do. We said we were interested in a tour that combined snorkeling and whale watching and booked the tour that was suggested. The only whales we saw were very far away and there was no attempt to get closer. Throughout the entire tour there was loud music blaring over the speakers - it was essentially a party boat - and no mention about whales at all. When we booked the tour we were told snorkeling equipment was included but they did not supply flippers. We were also told when we booked that we would have 1 hr to snorkel - we got maybe 15 minutes and were confined to a small area where there were hardly any fish. We were constantly being herded into a small area all together. The food they served for lunch was good. And the drinks were good.,5 months ago,"Thank you for taking the time to write about your experience with us.We are glad that you enjoyed food and drinks on board. Although snorkeling is an important attribute of our sailing experience, we have more outstanding activities around this tour, for this reason we only dedicate 45 for snorkeling. If you are looking for an exclusive snorkeling tour, we highly recommend our ""Snorkel and Sea Adventure"" and if you are looking for a whale watching tour we have 2 specific tours that dedicates to go search for whales but does not include snorkeling.Thank you for your time and visit, we hope to welcome you back soon!",1
380,2 months ago,"We had the best time! Bring a change of clothes if you do off roadÖ we got wet and dirty. However, even with out the change of clothes the whole adventure was the beat experience. Our tour guide Alain made our experience even more memorableÖ.watching the sunset as we ate amazing food and laughed over how to take a shot of tequila was unforgettable. Thank you so much Alain and Cabo adventures for being an unforgettable part of our cabo stay.",,,5
381,3 years ago,"We did the Sea of Cortez tour, and we were generally happy with the tour.The way from San Lucas to the Sea of Espirito Santo Islan is exhausting; 2.5 hours drive, and another two hours cruise to the Sea Lions' colony. But from that moment, we were in paradise.We did snorkeling with the Sea Lions, which was one of the most magical experiences I had. The bay was beautiful, the visibility was great and there were lots of fish and cutie Sea Lion babies that swam very close to us.We then went up to the yacht where the tour guide and the crew served fresh lunch of nachos, sandwiches and ceviche, and we enjoyed the open bar, which was part of the package deal we bought.On the way back to La Paz, the yacht made an hour stop at on of bays of Espirito Santo Island. We snorkeled at the green and beautiful water there, played on the floating mattress and enjoyed the sun and the beautiful view.Our tour guide was very professional and nice. The only thing we didn't like was the fact that on the way back, the tour guide decided to make an unplanned stop at a local taco restaurant / supermarket / kiosk - not sure what this place was.",,,5
382,2 months ago,This review is for camel adventure. We also had the sunset cruise which we loved. The adventure was ok but they will nickel and dime you for everything. They don‚Äôt let you take your own cameras so you end up purchasing their overpriced pictures. They charge $25 per person for entry (in addition to what you paid for adventure) but if you pay in pesos they will charge at 20pesos to dollar. Just ripping off tourists. $125 for 15 mins of camel ride and no pictures to relive. Don‚Äôt waste your money.,,,2
383,2 years ago,"Unique experience, we went on a little adventure to see DOLPHINS ‚ù§Ô∏è never in my life did I think I‚Äôd have this opportunity but thankfully I did. We got to play around with a baby dolphin and learnt about her too. She was amazing and did tricks for us, played around with us, and even took us for a ride! You are provided with a life vest, but fair warning the pool is pretty deep (>10ft) and if you‚Äôre scared don‚Äôt risk it, it‚Äôs all still fun without coming off the edge. Pretty pricey for the pictures and videos so please keep that in mind.",2 years ago,"Thank you for your 5-star opinion! We are very happy to read about your experience; indeed, our Dolphins program is a unique and memorable experience. We will be happy to pass along your comments to our Adventures team.",5
384,9 months ago,Went snorkeling with the sea lions with this place. It was an amazing day and they take care of everything! Our guide Razz was awesome,9 months ago,"Thank you for your amazing review and comments, especially regarding the service you received from our team members.We can't wait to see you again and create more fun memories!",5
385,2 months ago,"Kevin was an amazing guide. Super knowledgeable and informative. He was a blast to have on the boat, and kept us all safe and comfortable the whole trip. The captain and photographer also did a great job!",2 months ago,Thank you for taking the time to write such a wonderful review about Cabo Adventures. We are delighted to read you enjoyed your adventure and appreciate your comments regarding our service.We look forward to welcoming you back in the near future and creating more unforgettable memories together.,5
386,2 months ago,"Our group of 6 had an amazing time on this excursion with Captain Eric and his awesome crew. Attentive, entertaining, and so much fun!!  Both the snorkel and sailing parts were awesome. Highly recommend!!",,,5
387,2 months ago,"Amazing tour and kind service from our tour guide, Nico, and our captain, Russo! Everybody was so friendly and the ride was BEAUTIFUL ‚Äî highly recommended :)Started off by taking a nice boat ride by the arches, then we boarded the jet skis and rode along the coast at our own pace with our tour guide and captain nearby at all times. You can store your belongings in the boat while on the jet skis!",2 months ago,"Thank you for your amazing review and comments, especially regarding the service you received from our team members.All of us at Cabo Adventures look forward to welcoming you back in the near future and creating more fun memories. Hasta pronto!",5
388,2 months ago,We had such a great time on the luxury day sailing experience! The food was amazing. Cesar and Jaros (?) The crew members were a lot of fun. Highly recommend!,,,5
389,4 months ago,"The Mexican Outback & Camel Ride with Jorge 'Meow"" as our guide was one of the very best experiences of our entire cruise !  Jorge was fun, informative, and very attentive.  His lessons for proper tequila drinking were the perfect ending to the fantastic lunch we were served.  The entire Cabo Adventures Team was very professional and we very much appreciated their attention to safety.   The rescued camels were very fascinating and we love that they are now living their best lives at Cabo Adventure's beautiful facility.  It was obvious that the trainers and employees love the camels and love what their doing offering this experience to travelers.  The photographer was excellent; the speed and quality of the editing team, amazing.  Photos are expensive, in general.  These were worth every single dollar !  Well done !!",,,5
390,2 years ago,"We had an amazing snorkeling experience with Cabo Adventures. Our guided, Amilio, was   fun to be with and made sure we were safe while snorkeling.  An added bonus, while we were returning to port a pod of dolphins circled our Zodiac.  It was the icing on the cake.  It was one of my best days ever and I will use Cabo Adventures for any future excursions!",2 years ago,"Thanks for the awesome review! We work hard to meet expectations like yours, and we‚Äôre happy to hear we hit the mark for you. Come back and see us soon.",5
391,8 months ago,"Well a genuine feedback based on our experience.1. It‚Äôs difficult to understand them at phone but they will still do their best (you need to have patience). Office employees are really good and they will explain you everything and will offer online discount so an excellent service from the office employee. At the end they did everything on what they can. Manager went above and beyond to help us. Mucho Gracias Ulises and Angela!2. I‚Äôd hiccups with the photo department as they won‚Äôt give you the clear idea on prices for pictures. I visited 3 photo booth and they kept sending me from one place to another. And I agree that dolphin photos are ‚Äúvery expensive‚Äù and people in photo department won‚Äôt talk to you properly.3. Shuttle service is slow and takes time to come BUT now i understand that they have pickups. If you are waiting then I‚Äôd suggest to call the office or contact them on google asap. Person on google chat was very prompt and gave me the update on shuttle. Gracias.4. Zip line and UTV tour is beyond amazing. Amazed with the team members. Please don‚Äôt compare photo price with their service and give them bad reviews.I think photo department should be separate from them so people can give feedback only specific to photo department.Well overall I feel that I‚Äôll use them again because it‚Äôs a big company,  it‚Äôs safe, their office customer service is good, they helped me change the tour on same day and manager was amazing/exceptional.",8 months ago,Thank you for taking the time to write about your experience at Cabo Adventures! We are delighted to read you had a great time with us. Our team takes service very seriously and it is highly gratifying to read we achieved our ultimate goal of providing an exceptional experience for you and your family.We also appreciate you mentioned the opportunity areas you encountered during your visit; we will consider them in the future.We look forward to welcoming you back in the near future.,5
392,10 months ago,"The dolphin experience was great. Paola, our trainer, was excellent and very friendly. She knows her stuff and gave us full confidence of having a great time with Warrior. I learned something new and added a new experience.",10 months ago,"Thank you for sharing your experience at Cabo Dolphins!We are glad you loved it and look forward to welcoming you on a future adventure, during your next visit to Los Cabos.Warm regards",5
393,2 months ago,Entertaining and relaxing sunset cruise hosted by fun and energetic people (Sebastian).,2 months ago,"We truly appreciate your comments.It‚Äôs nice to know the service provided during the Luxury Sunset Sailing tour was friendly and attentive. As a company, we welcome all comments since they help us learn and improve.Best regards,",5
394,3 months ago,"We had an amazing time doing the zip-line and snorkeling adventures! The tour guides were great (Cedric and Christian for snorkeling, Arturo, Carlos, and Erick for zip-lining). They were funny and super helpful, and we always felt safe in the hands of experienced professionals. They have a nice facility and a wide variety of activities.",,,5
395,3 months ago,Jerry knows so knowledgeable about Whales. He was able to answer everyone‚Äôs questions and made the trip entertaining as well.  The captain was amazing steering towards the whales and stayed clear of other boats. I love that they all seem to care so much about the animals. What a fun and informative tour,,,5
396,a month ago,"Mario, Gerry, Eric, Johnny Mia were top notch on our lux 2 bay snorkel tour! The food was delish and they were so informative on the history of the reef. Would for sure do it again!",,,5
397,4 months ago,My daughter and I had a wonderful experience with Jose Louis and Aqua on our shore excursion with royal Caribbean. The Cabo adventures team was so wonderful. It was definitely an experience to remember. It was worth every giggle and smile that my daughter made. Now we just wait on the pictures which will hopefully come soon.,,,4
398,3 months ago,We had Kevin as our arch tour guide and he was very knowledgeable and fun! We got to see whales and have a fun boat ride! Michael was our camel guy and he was great at keeping the group engaged for all things camel and tequila!,,,5
399,a month ago,CaboAdventures always provides an excellent experience. Our family thoroughly enjoyed the sunset cruise. Great staff on the sailboat and on the shuttle van. Check-in was very organized.,,,5
400,a month ago,"My husband and I had an absolutely stellar time on the camel excursion with Jorge. The camel ride was amazing and informative, the food was unbeatable, and the humor and tequila tasting were unparalleled. He made our honeymoon an unforgettable experience.",a month ago,"Thank you for your amazing review and comments, especially regarding the service you received from our team members.We can't wait to see you again and create more fun memories!Hasta Pronto!",5
401,3 months ago,"I did the camels tour with the speed boat. Kevin was an amazing tour guide along with the captain of the boat! They made my experience unforgettable. He was super knowledged on all things including the lands, waters and history of the surrounding areas. To top it off, because we had some extra time, the took us out to see some whales! Best experience by far! Thank you cabo adventures for giving us such an amazing and humorous guide!",,,5
402,2 months ago,Real professionals; they know how to make memories! Chino was amazing!,2 months ago,"Thanks for the awesome review! We work hard to meet expectations like yours, and we‚Äôre happy to hear we hit the mark for you. Come back and see us soon.",5
403,3 months ago,"Amazing adventure! Me and my friends went on the snorkeling experience, Kevin and his team did a great job covering everything we saw, showing us all around and telling us lots of cool facts of cabo and before we went snorkeling we saw a ton of whales! Would definetly recommend especially at the reasonable price its at",3 months ago,"Thank you for sharing your experience at Cabo Adventures!We are glad you loved it and look forward to welcoming you on a future adventure, during your next visit to Los Cabos.Warm regards",5
404,a month ago,"I was in a group of 21 and we did the UTV tour. Gera and Richard were out guides and they were AWESOME! Very friendly, gave clear instructions, and they were really fun to ride around with.  After the tour we sat down to eat with them and they were a blast to talk to.  With a group as big as ours I know it can be a lot to work with, but they exceeded all expectations. I'd recommend this to anyone looking for an offroading experience in Cabo",a month ago,"We really appreciate your kind comments, the team will be happy to receive your feedback.From all the Cabo Adventures team we thank you for sharing your experience with other Adventurers!",5
405,2 months ago,"Had a blast at the camel ride! The food afterwards was amazing, especially the homemade tortillas!!!! Chicas was an amazing guide and kept us giggling all day! We enjoyed getting to learn about the chocolates and recycling!!! Truly a great experience :)",,,5
